{
  "schemaVersion": 1,
  "capturedAt": "2026-07-11T00:00:00.012177+00:00",
  "windowHours": 48,
  "signalCount": 28,
  "healthySourceCount": 6,
  "failedSourceCount": 0,
  "sourceStatus": [
    {
      "id": "openai_news",
      "name": "OpenAI News",
      "url": "https://openai.com/news/rss.xml",
      "state": "healthy",
      "itemCount": 5,
      "latestItemAt": "2026-07-10T07:00:00+00:00",
      "error": null
    },
    {
      "id": "github_changelog",
      "name": "GitHub Changelog",
      "url": "https://github.blog/changelog/feed/",
      "state": "healthy",
      "itemCount": 8,
      "latestItemAt": "2026-07-10T20:40:56+00:00",
      "error": null
    },
    {
      "id": "huggingface_blog",
      "name": "Hugging Face Blog",
      "url": "https://huggingface.co/blog/feed.xml",
      "state": "healthy",
      "itemCount": 1,
      "latestItemAt": "2026-07-10T00:00:00+00:00",
      "error": null
    },
    {
      "id": "ai_news_radar",
      "name": "AI News Radar",
      "url": "https://raw.githubusercontent.com/LearnPrompt/ai-news-radar/master/data/daily-brief.json",
      "state": "healthy",
      "itemCount": 20,
      "latestItemAt": "2026-07-10T22:07:19.177000+00:00",
      "error": null
    },
    {
      "id": "open_githubs_daily_rank",
      "name": "OpenGithubs Daily Rank",
      "url": "https://raw.githubusercontent.com/OpenGithubs/github-daily-rank/main/README.md",
      "state": "healthy",
      "itemCount": 0,
      "latestItemAt": "2026-07-08T16:00:00+00:00",
      "error": null
    },
    {
      "id": "hellogithub",
      "name": "HelloGitHub",
      "url": "https://github.com/521xueweihan/HelloGitHub/releases",
      "state": "healthy",
      "itemCount": 0,
      "latestItemAt": "2026-06-29T00:36:02+00:00",
      "error": null
    }
  ],
  "topSignals": [
    {
      "id": "signal_cd1e04a236d6",
      "kind": "official",
      "title": "OpenAI’s GPT-5.6 Sol, Terra, and Luna are now available in GitHub Copilot",
      "summaryZh": "GitHub Changelog 发布官方更新。该条目直接来自官方订阅源，建议先阅读原文再判断是否影响当前项目。",
      "url": "https://github.blog/changelog/2026-07-09-openais-gpt-5-6-sol-terra-and-luna-are-now-available-in-github-copilot",
      "source": "GitHub Changelog",
      "sourceUrl": "https://github.blog/changelog/feed/",
      "publishedAt": "2026-07-09T16:41:29+00:00",
      "score": 0.9087,
      "evidence": [
        "official_feed",
        "timestamped_source"
      ],
      "sources": [
        "GitHub Changelog"
      ]
    },
    {
      "id": "signal_2aa380daeea9",
      "kind": "official",
      "title": "GPT-5.6 is now the preferred model in Microsoft 365 Copilot",
      "summaryZh": "OpenAI News 发布官方更新。该条目直接来自官方订阅源，建议先阅读原文再判断是否影响当前项目。",
      "url": "https://openai.com/index/gpt-5-6-preferred-model-microsoft-365-copilot",
      "source": "OpenAI News",
      "sourceUrl": "https://openai.com/news/rss.xml",
      "publishedAt": "2026-07-09T13:00:00+00:00",
      "score": 0.8867,
      "evidence": [
        "official_feed",
        "timestamped_source"
      ],
      "sources": [
        "OpenAI News"
      ]
    },
    {
      "id": "signal_ad223990b9c5",
      "kind": "official",
      "title": "GitHub Mobile: Improved filters and sorting for Copilot sessions",
      "summaryZh": "GitHub Changelog 发布官方更新。该条目直接来自官方订阅源，建议先阅读原文再判断是否影响当前项目。",
      "url": "https://github.blog/changelog/2026-07-10-github-mobile-improved-filters-and-sorting-for-copilot-sessions",
      "source": "GitHub Changelog",
      "sourceUrl": "https://github.blog/changelog/feed/",
      "publishedAt": "2026-07-10T09:45:30+00:00",
      "score": 0.8521,
      "evidence": [
        "high_ai_relevance",
        "high_importance",
        "official_feed",
        "official_source",
        "timestamped_source"
      ],
      "sources": [
        "AI News Radar",
        "GitHub Changelog"
      ]
    },
    {
      "id": "signal_4c6e0e8d1c08",
      "kind": "official",
      "title": "CodeQL 2.26.0 adds Kotlin 2.4.0 support and AI prompt injection detection",
      "summaryZh": "GitHub Changelog 发布官方更新。该条目直接来自官方订阅源，建议先阅读原文再判断是否影响当前项目。",
      "url": "https://github.blog/changelog/2026-07-10-codeql-2-26-0-adds-kotlin-2-4-0-support-and-ai-prompt-injection-detection",
      "source": "GitHub Changelog",
      "sourceUrl": "https://github.blog/changelog/feed/",
      "publishedAt": "2026-07-10T20:40:56+00:00",
      "score": 0.8449,
      "evidence": [
        "high_ai_relevance",
        "high_importance",
        "official_feed",
        "official_source",
        "timestamped_source"
      ],
      "sources": [
        "AI News Radar",
        "GitHub Changelog"
      ]
    },
    {
      "id": "signal_cb0d32bf5c96",
      "kind": "official",
      "title": "Clearer names for secret scanning detector types",
      "summaryZh": "GitHub Changelog 发布官方更新。该条目直接来自官方订阅源，建议先阅读原文再判断是否影响当前项目。",
      "url": "https://github.blog/changelog/2026-07-10-clearer-names-for-secret-scanning-detector-types",
      "source": "GitHub Changelog",
      "sourceUrl": "https://github.blog/changelog/feed/",
      "publishedAt": "2026-07-10T20:06:10+00:00",
      "score": 0.8355,
      "evidence": [
        "high_ai_relevance",
        "high_importance",
        "official_feed",
        "official_source",
        "timestamped_source"
      ],
      "sources": [
        "AI News Radar",
        "GitHub Changelog"
      ]
    }
  ],
  "signals": [
    {
      "id": "signal_cd1e04a236d6",
      "kind": "official",
      "title": "OpenAI’s GPT-5.6 Sol, Terra, and Luna are now available in GitHub Copilot",
      "summaryZh": "GitHub Changelog 发布官方更新。该条目直接来自官方订阅源，建议先阅读原文再判断是否影响当前项目。",
      "url": "https://github.blog/changelog/2026-07-09-openais-gpt-5-6-sol-terra-and-luna-are-now-available-in-github-copilot",
      "source": "GitHub Changelog",
      "sourceUrl": "https://github.blog/changelog/feed/",
      "publishedAt": "2026-07-09T16:41:29+00:00",
      "score": 0.9087,
      "evidence": [
        "official_feed",
        "timestamped_source"
      ],
      "sources": [
        "GitHub Changelog"
      ]
    },
    {
      "id": "signal_2aa380daeea9",
      "kind": "official",
      "title": "GPT-5.6 is now the preferred model in Microsoft 365 Copilot",
      "summaryZh": "OpenAI News 发布官方更新。该条目直接来自官方订阅源，建议先阅读原文再判断是否影响当前项目。",
      "url": "https://openai.com/index/gpt-5-6-preferred-model-microsoft-365-copilot",
      "source": "OpenAI News",
      "sourceUrl": "https://openai.com/news/rss.xml",
      "publishedAt": "2026-07-09T13:00:00+00:00",
      "score": 0.8867,
      "evidence": [
        "official_feed",
        "timestamped_source"
      ],
      "sources": [
        "OpenAI News"
      ]
    },
    {
      "id": "signal_ad223990b9c5",
      "kind": "official",
      "title": "GitHub Mobile: Improved filters and sorting for Copilot sessions",
      "summaryZh": "GitHub Changelog 发布官方更新。该条目直接来自官方订阅源，建议先阅读原文再判断是否影响当前项目。",
      "url": "https://github.blog/changelog/2026-07-10-github-mobile-improved-filters-and-sorting-for-copilot-sessions",
      "source": "GitHub Changelog",
      "sourceUrl": "https://github.blog/changelog/feed/",
      "publishedAt": "2026-07-10T09:45:30+00:00",
      "score": 0.8521,
      "evidence": [
        "high_ai_relevance",
        "high_importance",
        "official_feed",
        "official_source",
        "timestamped_source"
      ],
      "sources": [
        "AI News Radar",
        "GitHub Changelog"
      ]
    },
    {
      "id": "signal_4c6e0e8d1c08",
      "kind": "official",
      "title": "CodeQL 2.26.0 adds Kotlin 2.4.0 support and AI prompt injection detection",
      "summaryZh": "GitHub Changelog 发布官方更新。该条目直接来自官方订阅源，建议先阅读原文再判断是否影响当前项目。",
      "url": "https://github.blog/changelog/2026-07-10-codeql-2-26-0-adds-kotlin-2-4-0-support-and-ai-prompt-injection-detection",
      "source": "GitHub Changelog",
      "sourceUrl": "https://github.blog/changelog/feed/",
      "publishedAt": "2026-07-10T20:40:56+00:00",
      "score": 0.8449,
      "evidence": [
        "high_ai_relevance",
        "high_importance",
        "official_feed",
        "official_source",
        "timestamped_source"
      ],
      "sources": [
        "AI News Radar",
        "GitHub Changelog"
      ]
    },
    {
      "id": "signal_cb0d32bf5c96",
      "kind": "official",
      "title": "Clearer names for secret scanning detector types",
      "summaryZh": "GitHub Changelog 发布官方更新。该条目直接来自官方订阅源，建议先阅读原文再判断是否影响当前项目。",
      "url": "https://github.blog/changelog/2026-07-10-clearer-names-for-secret-scanning-detector-types",
      "source": "GitHub Changelog",
      "sourceUrl": "https://github.blog/changelog/feed/",
      "publishedAt": "2026-07-10T20:06:10+00:00",
      "score": 0.8355,
      "evidence": [
        "high_ai_relevance",
        "high_importance",
        "official_feed",
        "official_source",
        "timestamped_source"
      ],
      "sources": [
        "AI News Radar",
        "GitHub Changelog"
      ]
    },
    {
      "id": "signal_447a8f27878d",
      "kind": "official",
      "title": "Per-user states for multi-user budgets in the REST API",
      "summaryZh": "GitHub Changelog 发布官方更新。该条目直接来自官方订阅源，建议先阅读原文再判断是否影响当前项目。",
      "url": "https://github.blog/changelog/2026-07-10-per-user-states-for-multi-user-budgets-in-the-rest-api",
      "source": "GitHub Changelog",
      "sourceUrl": "https://github.blog/changelog/feed/",
      "publishedAt": "2026-07-10T15:07:23+00:00",
      "score": 0.8236,
      "evidence": [
        "high_ai_relevance",
        "high_importance",
        "official_feed",
        "official_source",
        "timestamped_source"
      ],
      "sources": [
        "AI News Radar",